{"analysis":{"business_summary":{"conclusion":"公司以自制药品研发、生产和销售以及药品批发零售为主，核心经济可拆为高毛利品牌药品与健康品、低毛利大体量医药商业和中药资源供应链。2025年收入411.87亿元；商业板块规模大但不应与品牌工业品使用同一估值倍数。普通股股东现金路径主要是工业/健康品利润与商业周转形成经营现金，再扣维持性资本开支并通过高比例分红回流。","source_ids":["annual-2025","q1-2026","frozen-snapshot"]},"decisive_unknowns":{"conclusion":"决定性问题已部分回答：2025年主营现金近似用扣非利润与CFO-capex交叉核验为38-45亿元；商业应收及库存毛占用约170亿元；非经营投资收益约10.43亿元，不应与品牌主营同倍数资本化。仍未知分板块利润和净营运资金、投资资产可分配现金及2026Q1现金转换偏弱是否季节性。若半年报仍不能提供可信桥接，或应收增速持续高于收入且减值恶化，应停止追加研究；若现金转换恢复且基础回报达10%，再由主Agent决定是否购买下一层预算。","source_ids":["annual-2025","q1-2026","frozen-snapshot","legacy-report"]},"governance":{"conclusion":"公司披露无实际控制人，治理状态暂列可接受而非优秀。历史治理与股东结构需折价，2025年高比例现金分红对普通股股东现金回报有利；尚未见足以触发结构性停止的证据。","source_ids":["annual-2025","legacy-report"]},"market_mispricing":{"conclusion":"可能的错价不是简单的低PE，而是市场是否低估工业品结构改善、品牌资产和净现金/投资资产；反面是市场可能正确地为低增长商业业务、销售费用上升、应收占用和非经营投资收益打折。当前价格落在粗估价值区间下半部但不具宽安全边际，研究价值取决于半年报能否把现金转换与分板块利润拆清。","source_ids":["annual-2025","q1-2026","frozen-snapshot","quote-20260730"]},"owner_earnings_and_cycle":{"conclusion":"2023-2025年经营现金流分别35.03、42.97、46.00亿元，资本开支分别5.76、6.75、4.80亿元，对应简化自由现金流29.27、36.22、41.20亿元。2025年扣非归母净利48.65亿元，现金口径比利润口径更保守。考虑商业应收与库存的周期波动、投资收益不按高倍数资本化，正常化所有者收益暂取38-45亿元。2025年末应收及票据107.45亿元、库存62.31亿元，合计约占收入41%，但缺少应付账款桥接，不能把毛占用等同于净营运资金；2026Q1应收及票据升至125.09亿元，是下一份财报最关键的验证点。","source_ids":["annual-2025","q1-2026","frozen-snapshot"]},"survival":{"conclusion":"2025年末现金91.08亿元、有息债务4.88亿元，净现金约86.20亿元；资产负债率约26%，2026Q1有息债务进一步降至3.23亿元。现有证据不支持24个月内被迫融资或资本结构阻断，但商业应收信用质量仍需半年报账龄与减值核验。","source_ids":["annual-2025","q1-2026","frozen-snapshot"]},"valuation_basis":{"conclusion":"按2026年7月30日收盘价52.75元和约17.84亿股估算市值约941亿元。2025年归母净利51.53亿元对应静态PE约18.3倍，而不是manager-screen引用的11.33倍；后者与同一快照的市值和利润不相容，属于可核验事实错误。以38-45亿元正常化所有者收益、约86亿元净现金，并仅对长期股权/金融资产给折价价值，粗略合理价值48-60元。当前所有者收益率约4.0%-4.8%，叠加3%-5%可持续增长与股东分配，基础预期年化约8%，乐观情景约13.5%；当前并未明显跨过继续深研所需的10%基础门槛。","source_ids":["annual-2025","q1-2026","frozen-snapshot","quote-20260730","legacy-report"]}},"company_name":"云南白药","cycle_id":"2026-07-31-all-a-continuous-001-quick-001","price_as_of":"2026-07-30T15:34:54+08:00","price_source_id":"quote-20260730","profile":{"as_of":"2026-07-31","business_model_understood":true,"circle_of_competence":"inside","counterevidence":["2025年销售费用约56.19亿元、同比增长15.16%，显著快于收入2.88%的增速，工业与健康品增长未必能转化为同等利润弹性","2026年一季度经营现金流8.29亿元明显低于归母净利20.37亿元，且应收及票据由2025年末107.45亿元升至125.09亿元","2025年投资收益约10.43亿元，约相当于归母净利的20%；直接用归母净利或行情页PE会高估主营盈利确定性","医药商业收入体量大而毛利率低，若应收回款和库存周转恶化，表面低估值会被营运资金消耗抵销"],"decisive_unknowns":["2026年一季度经营现金流仅8.29亿元、约为归母净利20.37亿元的41%，应收及票据较2025年末增加约17.63亿元；半年报能否证明主要是季节性而非商业板块信用与渠道占款恶化","工业品、健康品和商业板块各自的营业利润、维持性资本开支及净营运资金占用尚未在当前压缩证据中完成拆分","2025年10.43亿元投资收益中权益法投资的可持续现金分配能力，以及长期股权投资折价后可归属于普通股股东的价值"],"governance_status":"acceptable","information_cutoff":"2026-07-31T04:31:33+08:00","normalized_earnings_status":"plausible","research_stage":"quick_profile","revisit_triggers":[{"condition":"2026年半年度报告披露后核验经营现金流、应收及票据、分板块收入利润和销售费用率","reason":"判断一季度现金转换偏弱是否季节性，并完成工业品与商业板块的净营运资金桥接","type":"filing"},{"condition":"在基本面未恶化时股价不高于47元，或经新财报校准后的基础情景预期年化回报达到10%","reason":"当前52.75元对应的基础预期回报约8%，尚未形成明显研究资本优势","type":"price"},{"condition":"工业品收入持续双位数增长且销售费用率下降，同时商业应收增速低于收入增速","reason":"这将验证利润结构改善不是由费用投放或渠道资金占用换取","type":"thesis"}],"s1_source_count":2,"structural_stop_reasons":[],"survival_status":"pass","symbol":"CN:000538","valuation":{"base_expected_annual_return":0.08,"bull_expected_annual_return":0.135,"current_price":52.75,"market_implied_assumptions_tested":true,"rough_fair_value_range":[48.0,60.0]},"variant_perception":"市场主要把公司视为低增长高分红资产；若工业品结构改善可持续且商业应收占用不继续扩大，约40-45亿元正常化所有者收益并叠加净现金及折价后的投资资产，可能支持当前价格以上的价值，但安全边际尚不宽。"},"provenance":{"agent":"/root/qp_baiyao","generated_at":"2026-07-31T06:48:00+08:00","model":"gpt-5.6-sol","tools":["repository shell inspection","official filing URLs from existing S1 source index","frozen manager-screen snapshot","Eastmoney push2 quote API","apply_patch"]},"schema_version":2,"sources":[{"accessed_at":"2026-07-31T05:30:00+08:00","local_path":null,"published_at":"2026-04-01","publisher":"云南白药集团股份有限公司","source_id":"annual-2025","supports":["2025年收入利润和现金流","资产负债表","投资收益","分红与治理"],"tier":"S1","title":"云南白药集团股份有限公司2025年年度报告","url":"https://www.yunnanbaiyao.com.cn/uploadDir/pdf/20260423/1776933642253.pdf"},{"accessed_at":"2026-07-31T05:30:00+08:00","local_path":null,"published_at":"2026-04-30","publisher":"云南白药集团股份有限公司（深交所披露）","source_id":"q1-2026","supports":["2026Q1利润与经营现金流","应收及票据变化","现金和债务"],"tier":"S1","title":"云南白药集团股份有限公司2026年第一季度报告","url":"https://disc.static.szse.cn/disc/disk03/finalpage/2026-04-30/691f089b-9086-464e-bf11-72915e313258.PDF"},{"accessed_at":"2026-07-31T05:25:00+08:00","local_path":"coverage/cn-a/snapshots/2026-07-31-all-a-continuous-001/companies.jsonl","published_at":"2026-07-31","publisher":"Trading OS（行情与财务事实源：东方财富接口）","source_id":"frozen-snapshot","supports":["2023-2025财务序列","2026Q1财务","2026-07-22价格和市值"],"tier":"S2","title":"全A股manager-screen冻结快照：CN:000538","url":null},{"accessed_at":"2026-07-31T06:47:00+08:00","local_path":null,"published_at":"2026-07-30","publisher":"东方财富","source_id":"quote-20260730","supports":["2026-07-30收盘价52.75元","总市值约941.20亿元","总股本约17.84亿股","行情时间"],"tier":"S2","title":"云南白药2026-07-30收盘行情快照","url":"https://push2.eastmoney.com/api/qt/stock/get?secid=0.000538&fields=f43,f44,f45,f46,f47,f48,f57,f58,f60,f86,f116,f117,f162,f167,f277,f279"},{"accessed_at":"2026-07-31T05:25:00+08:00","local_path":"research/companies/CN/000538/reports/2026-07-10-initial.md","published_at":"2026-07-10","publisher":"Trading OS历史研究资产","source_id":"legacy-report","supports":["分板块线索","投资收益线索","治理与分红线索","S1来源URL索引"],"tier":"S3","title":"2026-07-10云南白药初始深度研究（legacy_v1，仅作线索索引）","url":null}]}