{"analysis":{"business_summary":{"conclusion":"宁波银行是以长三角对公及零售银行为基础、叠加财富管理、金融市场、基金、金租、理财和消费金融的综合城商行。2025年利息净收入531.61亿元、占营收约73.9%，非息收入188.08亿元，其中手续费净收入60.85亿元；永赢基金、永赢金租、宁银理财和宁银消金扩展非息和客户服务。模式清晰且收入多元，但盈利质量需分开检验息差、手续费、公允价值、子公司和信用成本。","source_ids":["S1_ANNUAL_2025_002142","S1_Q1_2026_002142"]},"decisive_unknowns":{"conclusion":"下一阶段只解决五类会改变估值的问题：关注逾期重组迁徙；零售与宁银消金Vintage信用成本；房地产城投和投资资产最终敞口；非息及公允价值的正常化；普通股核心资本与资本工具替代关系。若个人及经营贷不良继续上升、净息差低于1.55%或核心一级资本低于8.5%，应下修合理PB；若风险迁徙稳定且非息可重复，再等待价格提供10%以上基准回报。","source_ids":["S1_ANNUAL_2025_002142","S1_Q1_2026_002142","S1_Q1_PILLAR3_2026_002142","S1_PERPETUAL_CAPITAL_20260529_002142","S1_TIER2_REDEMPTION_20260714_002142"]},"governance":{"conclusion":"治理暂评可接受。公司有地方国资、外资战略股东与市场化管理体系，年报审计和关联交易披露未显示立即不可投资的审计或控制权阻断；2026年多名董事及行长任职资格获监管核准。后续实质检验是大股东及关联授信是否同等分类、消费金融和子公司风险隔离是否有效、资本工具是否公平对待普通股，以及快速扩表是否保持风险纪律。","source_ids":["S1_ANNUAL_2025_002142","S1_Q1_PILLAR3_2026_002142"]},"market_mispricing":{"conclusion":"现价约0.93倍除息后PB、7倍滚动PE和3.76%历史全年股息率，市场隐含长期ROE约11%至12%、息差继续承压并承担零售和资本折价。若个人及消金不良趋稳、对公新增贷款保持质量、非息不依赖公允价值且核心一级资本不再下降，优质城商行估值可维持或略扩张；若信用损失滞后暴露，现价并非便宜。旧报告仅作反向审计入口，本轮不继承其价格、估值或操作结论。基准年化约7%，不足以在当前价格进入更深层研究。","source_ids":["S1_ANNUAL_2025_002142","S1_Q1_2026_002142","S1_Q1_PILLAR3_2026_002142","S1_DIVIDEND_20260709_002142","S2_TENCENT_CLOSE_20260727_002142","S3_LEGACY_20260708_002142"]},"owner_earnings_and_cycle":{"conclusion":"银行所有者收益以跨周期净利润扣除维持普通股监管资本所需留存估算。2025年收入719.69亿元、归母293.33亿元；2026Q1收入203.84亿元、归母81.81亿元，均约增长10%。在净息差1.73%、2025年信用减值损失同比增长43.08%、非息高增且资本偏紧的情况下，正常化归母利润暂估285亿至320亿元；现有约27%派息率反映大部分利润仍需内生补充资本，区间可建立但置信度中等。","source_ids":["S1_ANNUAL_2025_002142","S1_Q1_2026_002142"]},"survival":{"conclusion":"未来24至36个月生存测试通过。2026Q1不良率0.76%、拨备覆盖率369.39%，核心一级资本、一级资本和总资本充足率分别约9.25%、10.66%和14.02%，均高于监管要求。公司2026年完成一期无固定期限资本债发行，并公告赎回二级资本债，具备资本市场融资能力。主要风险不是短期流动性断裂，而是快速扩表继续消耗普通股核心资本并压缩分红或触发再融资。","source_ids":["S1_Q1_2026_002142","S1_Q1_PILLAR3_2026_002142","S1_PERPETUAL_CAPITAL_20260529_002142","S1_TIER2_REDEMPTION_20260714_002142"]},"valuation_basis":{"conclusion":"2026年7月27日完整收盘31.89元，总市值约2105.9亿元。Q1每股归母净资产35.21元扣除末期每股0.90元现金分红后约34.31元，现价约0.93倍PB。方法一按可持续ROE 12.5%至14%、股权成本10.5%至11.5%、长期增长3%至4%并加入资本和零售风险折价，给予0.85至1.05倍PB，对应29.2至36.0元；方法二按正常化EPS约4.3至4.8元给予7至8倍PE，对应30.1至38.4元，交叉取29至36.5元。三年基准按退出35元、累计分红3.9元，总回收38.9元，年化约6.9%；乐观按退出40元、累计分红4.2元，总回收44.2元，年化约11.5%。","source_ids":["S1_ANNUAL_2025_002142","S1_Q1_2026_002142","S1_DIVIDEND_20260709_002142","S2_TENCENT_CLOSE_20260727_002142"]}},"company_name":"宁波银行","cycle_id":"2026-07-27-all-a-funnel-002","price_as_of":"2026-07-27T15:00:00+08:00","price_source_id":"S2_TENCENT_CLOSE_20260727_002142","profile":{"as_of":"2026-07-27","business_model_understood":true,"circle_of_competence":"inside","counterevidence":["2025年个人贷款不良率1.94%、个体经营贷款不良率3.45%，显著高于全行0.76%，零售和经营贷风险已不是纯理论问题。","2025年信用减值损失152.79亿元、同比增长43.08%，利润增长同时需要更高风险成本，不能只看不良余额。","2025年净息差1.74%、同比下降12BP，2026Q1进一步为1.73%；存款成本下降暂时抵消资产收益率下行，但空间并非无限。","2026Q1公司贷款较年初增长16.58%，远快于个人贷款和利润；新增对公资产的信用损失通常滞后出现。","2026Q1核心一级资本充足率9.25%、总资本充足率14.02%，分别较年末继续下降，快速扩表对普通股资本形成约束。","2025年手续费及佣金净收入增长30.72%、2026Q1手续费收入增长67.70%，但财富管理、基金和市场业务受资本市场与公允价值周期影响，不能线性外推。","贷款区域集中于浙江63.31%和江苏22.65%，行业集中于租赁商务、制造、批零、房地产及建筑，长三角优势也是区域信用集中。","永赢基金、金租、理财和宁银消金丰富利润来源，也增加合并口径、少数股东、消费金融和非息资产穿透难度。","全行0.76%不良率和369.39%拨备覆盖率很强，但Q1未完整披露关注、逾期、重组与迁徙桥，低不良不能替代分类及时性。","2025年全年每股现金分红1.20元、派息率约27%，股息率提供部分回报，但大量利润必须留存以支持资本和贷款增长。","2026年发行无固定期限资本债并陆续赎回二级资本债，说明监管资本管理是持续任务，不能仅用总资本充足率判断普通股缓冲。"],"decisive_unknowns":["2025年及2026H1关注、逾期30天及90天以上、重组和展期贷款与不良的勾稽，不良偏离度、新生成不良、迁徙率、核销和回收分别是多少。","个人消费贷、信用卡、个体经营贷及宁银消金按Vintage、逾期期限、重组、核销和客群拆分后的真实信用成本，个人贷款不良率是否继续高于全行。","房地产开发、按揭、建筑业、地方国企及融资平台贷款和投资资产的最终债务人、担保、风险分类及减值覆盖，对公一季度高增长集中在哪些行业。","大额债券、同业、资管和其他投资资产按信用等级、期限、会计分类和减值阶段穿透后的风险，以及2025和2026Q1投资收益、公允价值及手续费增长的可重复性。","核心一级资本充足率9.25%下，无固定期限资本债发行和二级资本债赎回对资本结构、利息或分配、扩表与普通股分红的实际影响。"],"governance_status":"acceptable","information_cutoff":"2026-07-27T19:12:46+08:00","normalized_earnings_status":"plausible","research_stage":"quick_profile","revisit_triggers":[{"condition":"披露2026年半年度报告及资本充足率报告并桥接关注、逾期、重组、不良、核销和回收","reason":"半年报是验证低不良、对公高速扩张和资本消耗是否可持续的第一关键节点。","type":"filing"},{"condition":"按个人消费贷、个体经营贷、信用卡和宁银消金披露逾期迁徙、重组、Vintage及信用成本","reason":"零售分项不良明显高于全行，必须确定风险是见顶、稳定还是继续恶化。","type":"filing"},{"condition":"净息差跌破1.55%、不良率升至1%以上或拨备覆盖率跌破280%","reason":"任一变化都会削弱高ROE、低风险和优质PB的共同基础。","type":"thesis"},{"condition":"最近完整收盘价降至27元或以下，且资产质量、资本和息差未恶化","reason":"更低PB和更高股息率可为零售迁徙、非息波动与资本约束提供更充分补偿。","type":"price"},{"condition":"发生重大监管处罚、关联授信损失、资本工具发行赎回异常或核心管理层和主要股东显著变化","reason":"这些事件会直接改变治理、资本和低风险溢价。","type":"event"}],"s1_source_count":6,"structural_stop_reasons":[],"survival_status":"pass","symbol":"CN:002142","valuation":{"base_expected_annual_return":0.069,"bull_expected_annual_return":0.115,"current_price":31.89,"market_implied_assumptions_tested":true,"rough_fair_value_range":[29.0,36.5]},"variant_perception":"2026年7月27日完整收盘31.89元，对应总市值约2105.9亿元、约0.93倍扣除2025年度末期每股0.90元分红后的Q1归母净资产、约7.0倍滚动利润和3.76%历史全年股息率。市场给予优于普通城商行的估值，反映约14%ROE、0.76%不良率、综合金融平台和长三角客户优势，同时仍对低息差、零售风险和资本约束打折。错价成立必须证明个人贷款1.94%及个体经营贷3.45%的不良没有继续迁徙，对公高速扩张没有推迟信用成本，且投资与非息收益能够穿越公允价值周期。"},"provenance":{"agent":"/root/triage_600368","generated_at":"2026-07-27T19:12:46+08:00","model":"gpt-5","tools":["apply_patch","issuer annual and quarterly filings","issuer regulatory capital reports","Eastmoney issuer announcement index API","PowerShell Invoke-WebRequest","Tencent public historical quote API","repository historical research audit","jsonschema Draft 2020-12 validation"]},"schema_version":2,"sources":[{"accessed_at":"2026-07-27T19:10:00+08:00","local_path":null,"published_at":"2026-04-25","publisher":"宁波银行股份有限公司","source_id":"S1_ANNUAL_2025_002142","supports":["2025年收入719.69亿元、归母293.33亿元、净息差1.74%和拨备资产质量","利息净收入、非息、手续费及综合金融子公司利润结构","个人及个体经营贷款不良、信用减值损失和区域行业集中","投资资产、公允价值、房地产城投、资本、股东治理和关联授信入口","2025年全年每股现金分红1.20元安排"],"tier":"S1","title":"宁波银行股份有限公司2025年年度报告","url":"https://www.nbcb.com.cn/about_nbcb/information_diclosure/periodic_report/202604/W020260427623779586889.pdf"},{"accessed_at":"2026-07-27T06:28:00+08:00","local_path":null,"published_at":"2026-04-25","publisher":"宁波银行股份有限公司","source_id":"S1_Q1_2026_002142","supports":["2026Q1收入203.84亿元、归母81.81亿元及约10%增长","净息差1.73%、不良率0.76%和拨备覆盖率369.39%","客户贷款约1.90万亿元且公司贷款约1.25万亿元","核心一级资本充足率9.25%、总资本充足率14.02%","每股归母净资产35.21元"],"tier":"S1","title":"宁波银行股份有限公司2026年第一季度报告","url":"https://static.cninfo.com.cn/finalpage/2026-04-25/1225189427.PDF"},{"accessed_at":"2026-07-27T19:10:30+08:00","local_path":null,"published_at":"2026-04-25","publisher":"宁波银行股份有限公司","source_id":"S1_Q1_PILLAR3_2026_002142","supports":["核心一级、一级和总资本的监管口径","信用风险加权资产、市场风险及操作风险资本入口","表内外资产、交易对手和资本工具穿透入口","快速扩表对普通股核心资本的约束"],"tier":"S1","title":"宁波银行股份有限公司2026年第一季度第三支柱报告","url":"https://www.nbcb.com.cn/about_nbcb/investor_relations/regulatory_capital/zbczlbg/202604/W020260427586665347075.pdf"},{"accessed_at":"2026-07-27T19:11:00+08:00","local_path":null,"published_at":"2026-07-09","publisher":"宁波银行股份有限公司","source_id":"S1_DIVIDEND_20260709_002142","supports":["2025年度末期每10股派现金9元","末期每股0.90元于2026年7月除息实施","结合中期分红后全年每股现金分红1.20元","除息后每股净资产和历史股息率调整"],"tier":"S1","title":"宁波银行股份有限公司2025年年度权益分派实施公告","url":"https://pdf.dfcfw.com/pdf/H2_AN202607081826820118_1.pdf"},{"accessed_at":"2026-07-27T19:11:15+08:00","local_path":null,"published_at":"2026-05-29","publisher":"宁波银行股份有限公司","source_id":"S1_PERPETUAL_CAPITAL_20260529_002142","supports":["公司完成2026年第一期无固定期限资本债券发行","资本工具用于补充其他一级资本而非普通股核心一级资本","资本补充提高总缓冲但伴随利息或分配成本","需与普通股资本、扩表和分红共同评估"],"tier":"S1","title":"宁波银行关于2026年第一期无固定期限资本债券发行完毕的公告","url":"https://pdf.dfcfw.com/pdf/H2_AN202605281822954194_1.pdf"},{"accessed_at":"2026-07-27T19:11:30+08:00","local_path":null,"published_at":"2026-07-14","publisher":"宁波银行股份有限公司","source_id":"S1_TIER2_REDEMPTION_20260714_002142","supports":["公司公告赎回一项二级资本债券","二级资本工具变动影响总资本结构但不直接提高核心一级资本","需核对赎回金额、替代融资与资本充足率实际变化","资本工具管理反映扩表和监管资本的持续约束"],"tier":"S1","title":"宁波银行股份有限公司关于赎回二级资本债券的公告","url":"https://pdf.dfcfw.com/pdf/H2_AN202607131826933819_1.pdf"},{"accessed_at":"2026-07-27T19:11:55+08:00","local_path":null,"published_at":"2026-07-27T15:00:00+08:00","publisher":"腾讯证券行情","source_id":"S2_TENCENT_CLOSE_20260727_002142","supports":["2026年7月27日开盘31.96元、最高32.18元、最低31.40元、完整收盘31.89元","行情时间戳20260727161454且深市已经收盘","总市值约2105.89亿元、行情PE约7.00倍、PB约0.93倍","2025年度末期每10股派9元的除息记录"],"tier":"S2","title":"腾讯证券宁波银行日K线行情（2026年7月27日完整收盘）","url":"https://web.ifzq.gtimg.cn/appstock/app/fqkline/get?param=sz002142,day,,,20,qfq"},{"accessed_at":"2026-07-27T19:09:00+08:00","local_path":"research/companies/CN/002142/reports/2026-07-08-initial.md","published_at":"2026-07-08","publisher":"Trading OS历史研究","source_id":"S3_LEGACY_20260708_002142","supports":["旧结论和待核零售、投资资产与资本问题的反向审计入口","本轮不继承其价格、估值、操作或仓位结论","用最新年报、一季报、资本工具和完整收盘价重新建立判断"],"tier":"S3","title":"宁波银行2026年7月8日历史初始研究","url":null}]}