{"analysis":{"business_summary":{"conclusion":"公司以供水、污水处理、中水、垃圾焚烧及污泥餐厨处置为主，并承接供排水管网工程；供水运营及在建规模约440万吨/日，污水处理约500万吨/日，中水约130万吨/日，垃圾焚烧约1.2万吨/日。公司拥有50余个主要为25—30年的特许经营项目。2025年自来水制售、污水处理、管网工程和垃圾焚烧收入分别为26.80、39.56、5.30和7.52亿元，西南地区占收入88.32%。政府核价、长期特许经营和刚性公共服务需求使利润较稳定，但业务本质上重资产、回款依赖地方财政，并非轻资本现金牛。","source_ids":["annual_2025","frozen_snapshot"]},"decisive_unknowns":{"conclusion":"决定性问题得到可审计的区间答案：2025年维持性自由现金流约17—21亿元，扣现金利息后普通股可分配现金约12—16亿元；特许经营摊销已通过维持性资本开支锚反映，不能从经营现金流重复扣除。未来三年，洗瓦堰、自来水七厂三期、山南泽当、第六再生水厂二期和万兴三期等投产会增加收入和经营现金流，但也增加折旧摊销及停止资本化后的利息。2025年末95.55亿元在建工程和已披露重大在建项目约80亿元期末余额表明2026—2027年资本开支仍高；在没有项目级现金回报披露前，合理情景是维持性自由现金流随产能缓慢增至约19—24亿元、可分配现金约13—18亿元，而全口径股权自由现金流在资本开支高峰期仍接近零，只有到2028年前后资本开支降至约20—25亿元时才可能明显改善。该改善路径可信但尚未提供超过10%的基准回报，当前应等待财报、项目或价格触发。","source_ids":["annual_2025","q1_2026","frozen_snapshot"]},"governance":{"conclusion":"成都市国资委为实际控制人，2025年财务报表获标准无保留意见；收入确认及在建工程计量为关键审计事项，与项目制和特许经营业务的主要会计风险一致。2025年最大客户成都市财政局收入28.98亿元、占31.96%，政府客户集中既支持合同稳定性，也使回款、调价和资本配置受地方财政及国资目标影响。现有证据未显示普通股股东权利或报表可靠性的结构性阻断，治理评为可接受，但不能给予无折价评价。","source_ids":["annual_2025","frozen_snapshot"]},"market_mispricing":{"conclusion":"约10倍PE没有明显数据错误，但会掩盖利息在筹资现金流、扩张资本开支和应收增长对股东现金的消耗。当前约220.82亿元市值相当于正常化可分配现金约14—18倍，已计入成熟公用事业稳定性和中低个位数增长。市场可能低估项目集中投产后资本开支回落的现金释放，也可能低估地方财政回款压力、停止利息资本化和新增折旧摊销；在项目级回报和回款尚未闭环前，净错价不清晰。","source_ids":["annual_2025","q1_2026","frozen_snapshot","quote_20260730"]},"owner_earnings_and_cycle":{"conclusion":"2025年经营现金流37.01亿元已经包含经营性应收项目净增加5.12亿元和经营性应付项目净减少0.97亿元，因此不能再机械扣一次应收增长。现金流量表加回的固定资产折旧10.05亿元、使用权资产折旧0.31亿元、无形资产摊销6.76亿元和长期待摊摊销0.22亿元，合计约17.35亿元；其中服务特许经营权按经营期限直线摊销，经济上需要由未来更新投入覆盖。以折旧摊销为核心锚并允许维护时点波动，维持性资本开支暂估16—20亿元，得到包含实际应收增长后的维持性自由现金流约17—21亿元。中国现金流量表把利息支付列在筹资活动：2025年分配股利、利润或偿付利息现金11.04亿元，扣除普通股分红5.58亿元和少数股东分红0.29亿元，现金利息约5.17亿元；故普通股可分配现金约12—16亿元、每股约0.40—0.54元，而不是37亿元。2025年全部资本开支33.66亿元中约14—18亿元可视作扩张投入；全口径自由现金流仅3.34亿元，扣现金利息后约为负1.8亿元，扩张仍需借款和存量现金支持。","source_ids":["annual_2025","q1_2026","frozen_snapshot"]},"survival":{"conclusion":"2025年审计为标准无保留意见，连续三年扣非归母利润约18.04、19.63和19.66亿元，经营现金流约33.89、36.81和37.01亿元；2026Q1仍盈利并有44.16亿元货币资金，未显示24个月内生存或被迫股权融资风险。风险在资本结构而非短期生存：2026Q1有息债务约162.03亿元，是货币资金的约3.7倍，高资本开支需要债务市场持续开放。","source_ids":["annual_2025","q1_2026","frozen_snapshot"]},"valuation_basis":{"conclusion":"2026-07-30最新价7.40元、总市值约220.82亿元，东方财富TTM PE约10.47倍；manager-screen在7.26元时引用约10.27倍PE，差异来自价格更新而非事实错误。按12—16亿元正常化可分配普通股现金，当前现金收益率约5.4%—7.2%，2025年度拟每股派0.2352元对应约3.2%股息率。以每股正常化现金0.40—0.54元、中低个位数长期增长、9%—10%必要回报和高债务及回款折价交叉，粗略合理价值约6.8—8.8元。基准情形包含股息、约3%—4%每股现金增长和有限估值变化，年化回报约9%；只有项目按期投产、应收受控且资本开支明显回落时，乐观回报约14%。","source_ids":["annual_2025","q1_2026","frozen_snapshot","quote_20260730"]}},"company_name":"兴蓉环境","cycle_id":"2026-07-31-all-a-continuous-001-quick-001","price_as_of":"2026-07-30T15:34:36+08:00","price_source_id":"quote_20260730","profile":{"as_of":"2026-07-31","business_model_understood":true,"circle_of_competence":"inside","counterevidence":["2025年经营现金流37.01亿元，但购建长期资产现金支出33.66亿元，表观全口径自由现金流仅3.34亿元；再考虑约5.17亿元现金利息后仍为负值。","2025年末在建工程95.55亿元，占总资产18.72%，有息债务约156.18亿元；2026Q1有息债务进一步升至约162.03亿元，扩张依赖持续融资。","2025年经营性应收项目净增加5.12亿元，应收账款增加2.85亿元；2026Q1应收账款又较年初增加4.79亿元，信用减值损失同比增加31.57%。","2026Q1经营现金流同比增长51.25%主要因为购买商品、接受劳务支付的现金减少，并不证明政府回款改善；同期资本开支9.82亿元，远高于经营现金流1.74亿元。","最大客户成都市财政局贡献2025年收入28.98亿元、占31.96%，西南地区收入占88.32%，地方财政付款周期是现金收益的集中风险。","未来项目投产会增加收入和经营现金流，也会把在建工程转为固定及无形资产，带来新增折旧摊销和停止资本化后的利息，不能把全部新增收入视为股东现金。"],"decisive_unknowns":["2026—2028年各重大项目的剩余现金投入、投产收入、运营成本、折旧摊销和停止资本化后的利息分别是多少，公司能否给出可核验的项目级现金回报桥？","成都市财政局等政府客户应收账款能否在项目投产后回落，还是收入增长会继续被财政付款周期吸收？","万兴三期、第五和第八再生水厂等集中投产后，年度购建长期资产现金支出何时能降至约20—25亿元，并使全口径股权自由现金流持续转正？"],"governance_status":"acceptable","information_cutoff":"2026-07-31T06:12:00+08:00","normalized_earnings_status":"plausible","research_stage":"quick_profile","revisit_triggers":[{"condition":"2026年半年报披露后，复核应收账款、经营性应收净变动、经营现金流、资本开支、有息债务及已投产项目收入贡献。","reason":"半年报可验证Q1应收快速增长是否季节性，并更新项目投产后的现金桥。","type":"filing"},{"condition":"应收账款连续两个报告期增速高于收入10个百分点，或年度经营现金流减全部资本开支和现金利息连续两年为负。","reason":"任一情形都说明项目增长没有转化为普通股股东现金，需要下修正常化收益和合理价值。","type":"thesis"},{"condition":"在回款、债务和项目预算未同步恶化时，收盘价不高于6.6元。","reason":"该价格对应约12—16亿元正常化可分配股东现金的收益率和中低个位数增长，更接近继续研究所需的10%基准回报。","type":"price"},{"condition":"公司披露重大项目正式商业运行、调价、项目级投资回报，或地方财政付款安排发生可核验变化。","reason":"这些事件会直接改变未来三年的收入、资本开支和回款假设。","type":"event"}],"s1_source_count":2,"structural_stop_reasons":[],"survival_status":"pass","symbol":"CN:000598","valuation":{"base_expected_annual_return":0.09,"bull_expected_annual_return":0.14,"current_price":7.4,"market_implied_assumptions_tested":true,"rough_fair_value_range":[6.8,8.8]},"variant_perception":"市场把兴蓉环境定价为利润稳定、项目扩张可持续的地方水务环保平台；真正的分歧不在约10倍表观PE，而在37亿元经营现金流中只有约12—16亿元能在维持现有服务能力并支付现金利息后归属普通股股东，以及在建项目投产能否使资本开支回落快于应收和债务增长。当前价格大致资本化了中低个位数增长，没有给回款继续恶化留下很宽的安全边际。"},"provenance":{"agent":"/root/qp_luzhou","generated_at":"2026-07-31T06:14:00+08:00","model":"gpt-5.6-sol","tools":["repository evidence","PowerShell","CNInfo","pdfplumber","Eastmoney push2 quote API","apply_patch"]},"schema_version":2,"sources":[{"accessed_at":"2026-07-31T06:02:00+08:00","local_path":"tmp/pdfs/000598/1225212058-2025-annual.pdf","published_at":"2026-04-28","publisher":"成都市兴蓉环境股份有限公司","source_id":"annual_2025","supports":["业务规模与收入结构","经审计财务与现金流","固定资产折旧与特许经营权摊销","重大在建工程与投产进度","客户集中及治理审计"],"tier":"S1","title":"成都市兴蓉环境股份有限公司2025年年度报告","url":"https://static.cninfo.com.cn/finalpage/2026-04-28/1225212058.PDF"},{"accessed_at":"2026-07-31T06:03:00+08:00","local_path":"tmp/pdfs/000598/1225212065-2026-q1.pdf","published_at":"2026-04-28","publisher":"成都市兴蓉环境股份有限公司","source_id":"q1_2026","supports":["最新收入利润与现金流","应收账款与信用减值","资本开支与有息债务","项目投产进展"],"tier":"S1","title":"成都市兴蓉环境股份有限公司2026年第一季度报告","url":"https://static.cninfo.com.cn/finalpage/2026-04-28/1225212065.PDF"},{"accessed_at":"2026-07-31T04:55:06.300626+08:00","local_path":"coverage/cn-a/snapshots/2026-07-31-all-a-continuous-001/companies.jsonl","published_at":"2026-07-31","publisher":"Trading OS（底层财务数据源：东方财富数据中心）","source_id":"frozen_snapshot","supports":["2023至2025结构化财务事实","2026Q1资产负债现金流","证券身份与供应商估值字段"],"tier":"S2","title":"2026-07-31全A持续研究冻结事实快照：兴蓉环境记录","url":"https://datacenter.eastmoney.com/securities/api/data/v1/get"},{"accessed_at":"2026-07-31T06:10:00+08:00","local_path":null,"published_at":"2026-07-30","publisher":"东方财富","source_id":"quote_20260730","supports":["最新价格与行情时间","总市值与TTM PE","总股本"],"tier":"S2","title":"兴蓉环境2026-07-30最新行情快照","url":"https://push2.eastmoney.com/api/qt/stock/get?secid=0.000598&fields=f43,f44,f45,f46,f47,f48,f57,f58,f60,f86,f116,f117,f124,f162,f167,f168"}]}